{
  "$schema": "http://json-schema.org/draft-07/schema#",
  "title": "Character",
  "type": "object",
  "required": ["slug", "name", "class", "level", "hp", "ac", "abilities", "skills", "inventory", "features", "notes"],
  "additionalProperties": false,
  "properties": {
    "slug": {"type": "string"},
    "name": {"type": "string"},
    "class": {"type": "string"},
    "level": {"type": "integer", "minimum": 1},
    "hp": {"type": "integer", "minimum": 0},
    "ac": {"type": "integer", "minimum": 1},
    "abilities": {
      "type": "object",
      "required": ["str", "dex", "con", "int", "wis", "cha"],
      "additionalProperties": false,
      "properties": {
        "str": {"type": "integer"},
        "dex": {"type": "integer"},
        "con": {"type": "integer"},
        "int": {"type": "integer"},
        "wis": {"type": "integer"},
        "cha": {"type": "integer"}
      }
    },
    "skills": {
      "type": "object",
      "additionalProperties": {"type": "integer"}
    },
    "inventory": {
      "type": "array",
      "items": {"type": "string"}
    },
    "features": {
      "type": "array",
      "items": {"type": "string"}
    },
    "notes": {"type": "string"}
  }
}
